<?xml version = "1.0" encoding = "utf-8"?>
<!DOCTYPE TRANSACOES [
<!ELEMENT TRANSACOES (TRANSACAO)+>
<!ELEMENT TRANSACAO (CODIGO,ACAO,VALOR,DATA)>
<!ELEMENT CODIGO (#PCDATA)>
<!ELEMENT ACAO (#PCDATA)>
<!ELEMENT VALOR (#PCDATA)>
<!ELEMENT DATA (#PCDATA)>
]>